{"schema_version":"1.5","task_id":"p5-live-01","iteration":2,"mode":"revision","outcome":"patch","artifacts":{"revision_patch":{"schema_version":"1.0","task_id":"p5-live-01","page_id":"S01","from_iteration":1,"to_iteration":2,"base_plan_sha256":"ea61158a3046db70808a81d5762e8e7dad75476fb8ef7c5647d018aad9efdd1a","based_on_review_sha256":"d52d60407d44840fbd37c164617e7e97e285a15da59f4efb4ec3868b28c0c8c7","based_on_review_evaluation_sha256":"874144861ccd5dd4078cd23eca9a2b4fd9bb7a46d49fdabe3381f2199c756a71","targets":["card-02"],"linked_elements":[],"operations":[{"issue_id":"issue-01","element_id":"card-02","path":"/geometry/y","value":0.35}],"revision_reason":"Move card-02 upward to align its top edge with card-01 as shown in the Approved Design, resolving issue-01 while leaving approved and unrelated elements unchanged."}}}
