{"schema_version":"1.4","task_id":"p3-live-01","iteration":1,"mode":"initial","outcome":"plan","artifacts":{"reconstruction_plan":{"schema_version":"1.0","page":{"id":"S01","iteration":1},"source":{"approved_design":"source.png"},"slide":{"width_in":13.333,"height_in":7.5,"background":"#F5F8FB"},"elements":[{"id":"visual-hero-01","role":"hero_illustration","representation":"raster_asset","geometry":{"coordinate_space":"normalized","x":0.648,"y":0.182,"width":0.28,"height":0.56},"z_index":1,"asset_request":{"source":"approved_design","source_region":{"coordinate_space":"normalized","x":0.648,"y":0.182,"width":0.28,"height":0.56},"contains_text":false}},{"id":"connector-01","role":"flow","representation":"native_connector","geometry":{"coordinate_space":"normalized","x":0.284,"y":0.407,"width":0.07,"height":0.02},"z_index":2,"from_id":"card-01","to_id":"card-02","style":{"line":{"color":"#365E7C","width_pt":3.5,"dash":"solid","begin_arrow":"none","end_arrow":"triangle"}}},{"id":"card-01","role":"card","representation":"native_shape","geometry":{"coordinate_space":"normalized","x":0.069,"y":0.262,"width":0.216,"height":0.316},"z_index":3,"style":{"shape":"roundRect","fill":{"color":"#DCEAF7"},"line":{"color":"#3A6487","width_pt":2.25,"dash":"solid"},"radius_hint":0.08}},{"id":"card-02","role":"card","representation":"native_shape","geometry":{"coordinate_space":"normalized","x":0.354,"y":0.262,"width":0.215,"height":0.316},"z_index":3,"style":{"shape":"roundRect","fill":{"color":"#E5F0E2"},"line":{"color":"#31815B","width_pt":2.25,"dash":"solid"},"radius_hint":0.08}},{"id":"title-object","role":"title","representation":"native_text","geometry":{"coordinate_space":"normalized","x":0.05,"y":0.072,"width":0.2,"height":0.07},"z_index":4,"content_ref":"title-content","style":{"font_face":"Microsoft YaHei","font_size_pt":28,"bold":false,"color":"#142A43","align":"left","valign":"middle","margin_in":0,"fit":"shrink","language":"zh-CN"}},{"id":"card-01-title-object","role":"card_title","representation":"native_text","geometry":{"coordinate_space":"normalized","x":0.09,"y":0.307,"width":0.16,"height":0.05},"z_index":4,"content_ref":"card-01-title-content","style":{"font_face":"Microsoft YaHei","font_size_pt":20,"bold":false,"color":"#183B5A","align":"left","valign":"middle","margin_in":0,"fit":"shrink","language":"zh-CN"}},{"id":"card-01-body-object","role":"body","representation":"native_text","geometry":{"coordinate_space":"normalized","x":0.09,"y":0.386,"width":0.165,"height":0.079},"z_index":4,"content_ref":"card-01-body-content","style":{"font_face":"Microsoft YaHei","font_size_pt":16,"bold":false,"color":"#284D6B","align":"left","valign":"top","margin_in":0,"fit":"shrink","language":"zh-CN"}},{"id":"card-02-title-object","role":"card_title","representation":"native_text","geometry":{"coordinate_space":"normalized","x":0.374,"y":0.307,"width":0.17,"height":0.05},"z_index":4,"content_ref":"card-02-title-content","style":{"font_face":"Microsoft YaHei","font_size_pt":20,"bold":false,"color":"#17583F","align":"left","valign":"middle","margin_in":0,"fit":"shrink","language":"zh-CN"}},{"id":"card-02-body-object","role":"body","representation":"native_text","geometry":{"coordinate_space":"normalized","x":0.374,"y":0.386,"width":0.17,"height":0.079},"z_index":4,"content_ref":"card-02-body-content","style":{"font_face":"Microsoft YaHei","font_size_pt":16,"bold":false,"color":"#2D644D","align":"left","valign":"top","margin_in":0,"fit":"shrink","language":"zh-CN"}}]}}}
