{"schema_version":"1.4","task_id":"p4-live-01","iteration":1,"mode":"initial","outcome":"plan","artifacts":{"reconstruction_plan":{"schema_version":"1.1","page":{"id":"S01","iteration":1},"source":{"approved_design":"source.png"},"slide":{"width_in":13.333,"height_in":7.5,"background":"#FFFFFF"},"elements":[{"id":"divider-01","role":"title-divider","representation":"native_shape","geometry":{"coordinate_space":"normalized","x":0.06,"y":0.155,"width":0.88,"height":0.003},"z_index":0,"style":{"shape":"rect","fill":{"color":"#D9E7F7"}}},{"id":"chart-panel-01","role":"chart-panel","representation":"native_shape","geometry":{"coordinate_space":"normalized","x":0.075,"y":0.245,"width":0.4,"height":0.555},"z_index":1,"style":{"shape":"roundRect","fill":{"color":"#F7FAFE"},"line":{"color":"#D4E3F5","width_pt":1},"radius_hint":0.08}},{"id":"title-object","role":"title","representation":"native_text","geometry":{"coordinate_space":"normalized","x":0.06,"y":0.065,"width":0.3,"height":0.065},"z_index":2,"content_ref":"title-content","style":{"font_face":"Microsoft YaHei","font_size_pt":28,"bold":true,"color":"#172B52","align":"left","valign":"middle","margin_in":0,"fit":"shrink","language":"zh-CN"}},{"id":"chart-01","role":"evidence","representation":"native_chart","geometry":{"coordinate_space":"normalized","x":0.115,"y":0.375,"width":0.325,"height":0.405},"z_index":3,"data_ref":"data-chart-01","style":{"chart_type":"vertical_bar","show_legend":false,"show_value":true,"number_format":"0.00","color_tokens":["#4472C4"],"font_face":"Microsoft YaHei"}},{"id":"table-banner-01","role":"table-header-band","representation":"native_shape","geometry":{"coordinate_space":"normalized","x":0.525,"y":0.3,"width":0.4,"height":0.11},"z_index":4,"style":{"shape":"roundRect","fill":{"color":"#D9E7F7"},"line":{"color":"#5B9BD5","width_pt":1},"radius_hint":0.07}},{"id":"table-01","role":"detail","representation":"native_table","geometry":{"coordinate_space":"normalized","x":0.525,"y":0.405,"width":0.4,"height":0.32},"z_index":5,"data_ref":"data-table-01","style":{"font_face":"Microsoft YaHei","font_size_pt":16,"color":"#172B52","header_fill":"#D9E7F7","header_bold":true,"body_fill":"#FFFFFF","border_color":"#5B9BD5","border_width_pt":1,"align":"left","valign":"middle","margin_in":0.08,"number_format":"0.00","column_width_ratios":[1.2,0.9,0.9],"row_height_ratios":[1,1,1]}}]}}}
