{"schema_version":"1.4","task_id":"p4-live-01","iteration":1,"mode":"initial","outcome":"plan","artifacts":{"reconstruction_plan":{"schema_version":"1.1","page":{"id":"S01","iteration":1},"source":{"approved_design":"source.png"},"slide":{"width_in":13.333,"height_in":7.5,"background":"#FFFFFF"},"elements":[{"id":"title-object","role":"title","representation":"native_text","geometry":{"coordinate_space":"normalized","x":0.07,"y":0.06,"width":0.86,"height":0.1},"z_index":1,"content_ref":"title-content","style":{"font_face":"Microsoft YaHei","font_size_pt":28,"bold":true,"color":"#1F1F1F","align":"left","valign":"middle","margin_in":0,"fit":"shrink","language":"zh-CN"}},{"id":"chart-01","role":"evidence","representation":"native_chart","geometry":{"coordinate_space":"normalized","x":0.08,"y":0.24,"width":0.4,"height":0.58},"z_index":2,"data_ref":"data-chart-01","style":{"chart_type":"vertical_bar","show_legend":false,"show_value":true,"number_format":"0.00","color_tokens":["#4472C4"],"font_face":"Microsoft YaHei"}},{"id":"table-01","role":"detail","representation":"native_table","geometry":{"coordinate_space":"normalized","x":0.56,"y":0.29,"width":0.35,"height":0.38},"z_index":2,"data_ref":"data-table-01","style":{"font_face":"Microsoft YaHei","font_size_pt":16,"color":"#1F1F1F","header_fill":"#D9E7F7","header_bold":true,"body_fill":"#FFFFFF","border_color":"#5B9BD5","border_width_pt":1,"align":"center","valign":"middle","margin_in":0.06,"number_format":"0.00","column_width_ratios":[1,1,1],"row_height_ratios":[1,1,1]}}]}}}
