{"schema_version":"1.5","task_id":"p5-live-01","iteration":1,"mode":"revision","outcome":"patch","artifacts":{"revision_patch":{"schema_version":"1.0","task_id":"p5-live-01","page_id":"S01","from_iteration":1,"to_iteration":2,"base_plan_sha256":"0bd301216eed32da245b32b57b45a7af186e5edf739ba8036fe10d392754fcd7","based_on_review_sha256":"ee916ff4d9a98ba89962fd5d36d60797b0e0e60f31380acfeb5a03c77c1254e6","based_on_review_evaluation_sha256":"4c664e7d72089057dfbdb5f5574aa3dc0883dc1309976fc3152724f94ff790b0","targets":["card-02"],"linked_elements":[],"operations":[{"issue_id":"issue-01","element_id":"card-02","path":"/geometry/y","value":0.42}],"revision_reason":"Move card-02 upward while preserving its connector alignment and all non-target elements."}}}
